<?xml version="1.0" encoding="UTF-8"?>
<!-- XML Sample Message of message hierarchy                                          -->
<!-- Message:             ADC BAS Bank Account v1.0 Rev. 6                            -->
<!-- Transaction:         AA - Audit Data Collection Rev. 271                         -->
<!-- Datamodel:           Audit Data Collection Datamodel, version HEAD Rev. 347      -->
<!-- XML tagset used:     AdcsML                                                      -->
<!-- Generated at:        02-05-2021 15:29:42                                         -->
<!-- Generated using:     EC-Design 2.5.0 (http://www.ec-design.nl)                   -->
<!-- Generated by:        Jan Vrijenhoek (Digitect)                                   -->
<!-- Organisation:        Digitect B.V. (Digitect)                                    -->
<!-- NOTE:    This sample message was generated automatically: manual modifications will be lost -->
<AdcBasBankAccount xsi:schemaLocation="http://schemas.iso.org/AdcsML/Messages/AdcBasBankAccount-v1 AdcBasBankAccount.xsd"
		xmlns="http://schemas.iso.org/AdcsML/Messages/AdcBasBankAccount-v1"
		xmlns:xsi="http://www.w3.org/2001/XMLSchema-instance">
	<BasBankAcnt>
		<BankAcntNr>NL99BANK1234123412</BankAcntNr>
		<BankAcntNm>BANK</BankAcntNm>
		<BankCd>NL99BANK</BankCd>
		<BankNm>International Trade Bank</BankNm>
		<BraCd>Branche 1</BraCd>
		<BraNm>Branche name 1</BraNm>
		<BraCntryCd>US</BraCntryCd>
		<BraRegion>NY</BraRegion>
		<ActiveFlag>true</ActiveFlag>
		<BusSg>
			<BusSgCd>1234</BusSgCd>
		</BusSg>
	</BasBankAcnt>
</AdcBasBankAccount>
